103970	how long does amoxicilin work for
102043	drug teting in animals
106158	mobile omes for sale
110843	washington state goverment
110434	university of tennesse
109599	taning bed eye damage
100508	car accident lawers
104009	how to clean siver
107625	polar hear rate monitor
99118	alchol and drug rehab
105581	mab about you
102610	flee market buildings
103451	guide to create a cover latter
105415	los angelel unified school district
105899	medal taste in mouth symptoms
4271677555	stint for kidney stones
111056	what to feed tood frogs
111014	what is acid reflex
109832	the great catsby
110633	venitian las vegas
110445	untied health care
100382	cache creek casion
103540	haravrd medical school
2230899496	congential seizures in dogs
109323	steelers heinz filed tickets
109873	the miami hearld
104925	kindey bun levels
108039	real gohst pics
110090	toliet gurgles after flushing
103963	how far is it from san diego to tiajuana mexico
109410	student loans from a banck
105826	mason dixson line
104867	kenmore elite refridgerator
108875	singer axel rose
110271	troy built tiller
99450	ared hat society
99636	azygous lobe in the lung
104063	how to plant a graden
109978	things to do when broed
104002	how to blanch frise
103983	how money does the show seinfled make
102400	facts about chirs brown
109537	symptoms of gential herpes
104037	how to get ride of dust mites
111026	what is leader of algonquians civilization
110992	what causes stomache cancer
1245295473	what is acreis
104345	information on water lilly
99431	applying for bussiness loans
99478	army physical fittness test
103973	how long to wait after an oral intervew
104107	how to write a foral letter
111043	what kind of medicine is zytec
104047	how to lay basemen drain pipes
110999	what does excupatory mean
111024	what is hepatitus
103941	how did confusianism create order in china
103945	how do i clean my computor monitor screen
104012	how to clear bad exzema
111002	what does the declaration of independance represent
